name,designation,email,phone
Ashok Ajoy,Assistant Professor in Chemistry,ashokaj@berkeley.edu,(617) 233-1871
A. Paul Alivisatos,Samsung Distinguished Professor in Nanoscience and Nanotechnology Research,paul.alivisatos@berkeley.edu,
Richard A. Andersen,In Memoriam,raandersen@lbl.gov,
John Arnold,Associate Dean for Undergraduate Affairs;Professor of Chemistry,arnold@berkeley.edu,
Polly L. Arnold,"Professor of Chemistry;Chemical Sciences Division Director, Lawrence Berkeley National Laboratory",pla@berkeley.edu(link%20sends%20e-mail),
Anne M. Baranger,"Associate Dean for Diversity, Equity, and Inclusion;Faculty Assistant for Teaching and Learning;Adjunct Professor of Chemistry;Associate Teaching Professor",abaranger@berkeley.edu,
Kwabena Bediako,The Cupola Era Professor in the College of Chemistry;Assistant Professor of Chemistry,bediako@berkeley.edu,
Robert G. Bergman,"THE GERALD E. K. BRANCH DISTINGUISHED PROFESSOR OF CHEMISTRY, EMERITUS",rbergman@berkeley.edu,
Kristie A. Boering,Professor of Chemistry;Professor of Earth and Planetary Science;The Lieselotte and David Templeton Professor of Chemistry,boering@berkeley.edu,
Carlos J. Bustamante,"Professor of Chemistry, Physics and Molecular and Cell Biology;The Raymond and Beverly Sackler Professor in Biophysics",bustamante@cchem.berkeley.edu,
Jamie H. D. Cate,"Professor of Chemistry, Biochemistry and Molecular Biology",jcate@lbl.gov,
Joseph Cerny,Professor of the Graduate School;Professor Emeritus,jcerny@berkeley.edu,
David Chandler,Professor of the Graduate School (1944-2017),chandler@berkeley.edu,
Christopher J. Chang,Research Interests,chrischang@berkeley.edu,
Michelle C. Chang,Professor of Chemistry;Professor of Chemical & Biomolecular Engineering,mcchang@berkeley.edu,
Ronald C. Cohen,Professor of Chemistry and of Earth and Planetary Sciences,rccohen@berkeley.edu,
Jennifer A. Doudna,Nobel Laureate;Professor of Chemistry;Professor of Biochemistry & Molecular Biology;Li Ka Shing Chancellor's Professor in Biomedical and Health,doudna@berkeley.edu,
Felix R. Fischer,Associate Professor of Chemistry,ffischer@berkeley.edu,
Graham R. Fleming,Research Interests,grfleming@lbl.gov,
Matthew B. Francis,"Chair, Department of Chemistry;Professor of Chemistry",mbfrancis@berkeley.edu,
Phillip Geissler,The Aldo DeBenedictis Distinguished Professor of Chemistry,geissler@berkeley.edu,
Naomi Ginsberg,Associate Professor of Chemistry,nsginsberg@berkeley.edu,
Jay T. Groves,Professor of Chemistry,jtgroves@lbl.gov,
Robert A. Harris,Professor of the Graduate School,raharris@berkeley.edu,
Charles B. Harris,Professor of the Graduate School,cbharris@berkeley.edu,
John F. Hartwig,Research Interests,jhartwig@berkeley.edu,
Martin P. Head-Gordon,The Kenneth S. Pitzer Distinguished Professor of Chemistry,mhg@bastille.cchem.berkeley.edu,
Teresa Head-Gordon,"CHANCELLOR'S PROFESSOR OF CHEMISTRY, BIOENGINEERING, AND CHEMICAL & BIOMOLECULAR ENGINEERING",thg@berkeley.edu,
Sung-Hou Kim,Professor of the Graduate School,shkim@cchem.berkeley.edu,
Judith P. Klinman,Professor of the Graduate School;Chancellor's Professor,klinman@berkeley.edu,
John Kuriyan,Professor of Chemistry,kuriyan@berkeley.edu,
Stephen R. Leone,Research Interests,srl@berkeley.edu,
David Limmer,Assistant Professor of Chemistry,dlimmer@berkeley.edu,
"William A. Lester, Jr.",Professor of the Graduate School,walester@berkeley.edu,
Jeffrey R. Long,PROFESSOR OF CHEMISTRY,jrlong@berkeley.edu%20,
Thomas Maimone,Associate Professor of Chemistry,maimone@berkeley.edu,
Michael Marletta,Professor of Chemistry,marletta@berkeley.edu,
Susan Marqusee,Eveland Warren Endowed Chair & Professor of Molecular and Cell Biology;Professor of Chemistry;Director of QB3,,(510) 642-7678
Richard A. Mathies,Professor of the Graduate School,ramathies@berkeley.edu,
Evan Miller,Associate Professor of Chemistry and Molecular & Cell Biology,evanwmiller@berkeley.edu,TBA
William H. Miller,Professor of the Graduate School,millerwh@berkeley.edu,
Luciano G. Moretto,Professor Emeritus,lgmoretto@lbl.gov,
Daniel M. Neumark,Professor of Chemistry,dneumark@berkeley.edu,
Eric Neuscamman,Assistant Professor of Chemistry,eneuscamman@berkeley.edu,
Heino Nitsche,Professor of Chemistry (1949-2014),hnitsche@berkeley.edu,
Daniel K. Nomura,Professor of Chemistry;Professor of Molecular and Cell Biology and Nutritional Sciences and Toxicology,dnomura@berkeley.edu,Office & Lab (510) 643-7258
Alexander Pines,THE GLENN T. SEABORG PROFESSOR EMERITUS;EMERITUS PROFESSOR OF CHEMISTRY;PROFESSOR OF THE GRADUATE SCHOOL,pines@berkeley.edu,
Eran Rabani,GLENN T. SEABORG CHAIR IN PHYSICAL CHEMISTRY,eran.rabani@berkeley.edu,
Kenneth N. Raymond,Professor of the Graduate School;Chancellor's Professor,raymond@socrates.berkeley.edu,
Jonathan Rittle,The Chevron Professor of Chemistry;Assistant Professor of Chemistry,rittle@berkeley.edu,
Richmond Sarpong,Professor of Chemistry,rsarpong@berkeley.edu,
Richard J. Saykally,Professor of Chemistry;Class of 1932 Endowed Professor,saykally@berkeley.edu,
Alanna Schepartz,"Professor of Chemistry;The T.Z. and Irmgard Chu Distinguished Chair in Chemistry;Professor of Molecular and Cell Biology;Faculty Affiliate, California Institute for Quantitative Biosciences (QB3)",schepartz@berkeley.edu,
Kevan Shokat,Professor of Chemistry,kevan.shokat@ucsf.edu,
Berend Smit,Research Interests,Berend-Smit@Berkeley.edu,
Gabor A. Somorjai,Research Interests,somorjai@berkeley.edu%20,
Angelica Stacy,Professor Emeritus,astacy@berkeley.edu,
T. Don Tilley,PMP Tech Chancellor�s Chair in Chemistry;Professor of Chemistry,tdtilley@berkeley.edu,
Ignacio Tinoco,Professor of the Graduate School (1930-2016),%20intinoco@lbl.gov,
Dean Toste,THE GERALD E. K. BRANCH DISTINGUISHED PROFESSOR OF CHEMISTRY,fdtoste@berkeley.edu,
Peter C. Vollhardt,Professor of Chemistry,kpcv@berkeley.edu,
David E. Wemmer,Emeritus Professor of Chemistry;Professor of the Graduate School,email,
K. Birgitta Whaley,"Professor of Chemistry;Director, Berkeley Quantum Information and Computation Center",email,
Evan R. Williams,Professor of Chemistry,erw@berkeley.edu,
Ke Xu,Associate Professor of Chemistry,xuk@berkeley.edu,
Ting Xu,Professor of Chemistry & Materials Science and Engineering,tingxu@berkeley,
Omar Yaghi,The James and Neeltje Tretter Professor of Chemistry,yaghi@berkeley.edu,
Peidong Yang,Research Interests,p_yang@berkeley.edu,
Michael W. Zuerch,Assistant Professor of Chemistry,ldietterick@berkeley.edu,(510) 697-2342
