name,designation,email,phone
Valerie S Ashby,Professor of Chemistry,valerie.ashby@duke.edu,
Steven W. Baldwin,Professor of Chemistry,steven.baldwin@duke.edu,
Matthew L Becker,Hugo L. Blomquist Distinguished Professor of Chemistry,matthew.l.becker@duke.edu,
David N. Beratan,R.J. Reynolds Distinguished Professor of Chemistry,david.beratan@duke.edu,
Dorian Canelas,Associate Professor of the Practice of Chemistry,dorian.canelas@duke.edu,
Patrick Charbonneau,Professor of Chemistry,patrick.charbonneau@duke.edu,
Charlie Terrence Cox,AssociateProfessor of the Practice of Chemistry,charlie.cox@duke.edu,
Stephen L Craig,William T. Miller Distinguished Professor of Chemistry,stephen.craig@duke.edu,
Emily R. Derbyshire,Assistant Professor of Chemistry,emily.derbyshire@duke.edu,
Michael C. Fitzgerald,Professor of Chemistry,michael.c.fitzgerald@duke.edu,
Katherine J. Franz,Chair of the Department of Chemistry,katherine.franz@duke.edu,
Amanda Hargrove,Associate Professor of Chemistry,amanda.hargrove@duke.edu,
Jiyong Hong,Professor of Chemistry,jiyong.hong@duke.edu,
Jie Liu,George Barth Geller Distinguished Professor of Chemistry,j.liu@duke.edu,
Richard MacPhail,Associate Professor of Chemistry,richard.macphail@duke.edu,
Steven Malcolmson,Associate Professor of Chemistry,steven.malcolmson@duke.edu,
Dewey G. McCafferty,Professor of Chemistry,dewey.mccafferty@duke.edu,
Jennifer Roizen,Assistant Professor of Chemistry,jennifer.roizen@duke.edu,
Christopher P. Roy,Associate Professor of the Practice of Chemistry,chris.roy@duke.edu,
Michael J. Therien,"William R. Kenan, Jr. Distinguished Professor of Chemistry",michael.therien@duke.edu,
Qiu Wang,Robert R. & Katherine B. Penn Associate Professor,qiu.wang@duke.edu,
Warren S. Warren,James B. Duke Distinguished Professor of Chemistry,warren.warren@duke.edu,
Kevin D. Welsher,Assistant Professor of Chemistry,kdw32@duke.edu,
Ross A. Widenhoefer,Professor of Chemistry,ross.widenhoefer@duke.edu,
Benjamin J. Wiley,Professor of Chemistry,benjamin.wiley@duke.edu,
Weitao Yang,Philip Handler Distinguished Professor of Chemistry,weitao.yang@duke.edu,
