name,designation,email,phone
Adeel Bhutta,Senior Lecturer,aabhutta@indiana.edu,+1(812) 855-3147
Saul Blanco,Visiting Assistant Professor,sblancor@indiana.edu,
Randall Bramley,Professor Emeritus of Computer Science,bramley@cs.indiana.edu,+1(812) 855-7790
Volker Brendel,Director of Bioinformatics;Professor of Biology and Computer Science,vbrendel@indiana.edu,+1(812) 855-7074
Geoffrey Brown,Professor of Computer Science,geobrown@cs.indiana.edu,
Jean Camp,"Director of Center for Security and Privacy in Informatics, Computing, and Engineering;Professor of Informatics",ljcamp@indiana.edu,+1(812) 856-1865
David Crandall,Director of Graduate Studies for Computer Science;Associate Professor of Informatics and Computing,djcran@indiana.edu,+1(812) 856-1115
Mehmet Dalkilic,Director of Undergraduate Studies for Data Science;Associate Professor of Informatics and Computing,dalkilic@indiana.edu,+1(812) 856-3010
Funda Ergun,Professor of Computer Science,fergun@indiana.edu,
Daniel Friedman,Professor of Computer Science,dfried@indiana.edu,+1(812) 855-4885
Dan-Adrian German,Senior Lecturer,dgerman@indiana.edu,+1(812) 855-7860
Dennis Groth,Interim Dean,iuldean@indiana.edu,+1(812) 856-1079
Matthew Hahn,Director of Center for Bioinformatics Research;Professor of Computer Science,mwh@indiana.edu,+1(812) 856-7001
Mitja Hmeljak,Senior Lecturer,mitja@indiana.edu,+1(812) 855-7198
Douglas Hofstadter,College of Arts and Sciences Distinguished Professor of Cognitive Science and Computer Science,dughof@indiana.edu,+1(812) 855-6964
Yan Huang,Assistant Professor,yh33@indiana.edu,+1(812) 856-3241
Apu Kapadia,Director of Graduate Admissions for Computer Science;Associate Professor of Computer Science,kapadia@indiana.edu,+1(812) 856-1465
Roni Khardon,Professor of Computer Science,rkhardon@iu.edu,+1(812) 855-4075
David Leake,Professor of Computer Science,leake@indiana.edu,+1(812) 855-9756
Daniel Leivant,Professor of Computer Science,leivant@indiana.edu,+1(812) 855-6221
Xiaojing Liao,Assistant Professor of Computer Science,xliao@iu.edu,
Xiaozhong Liu,Ph.D. Program Director for Information Science;Associate Professor of Information Science,liu237@indiana.edu,
Vel Malbasa,Clinical Professor,vmalbasa@indiana.edu,+1(812) 856-1872
Michael McRobbie,"President, Indiana University;Professor of Computer Science and Informatics",mcrobbie@indiana.edu,+1(812) 855-5752
Gerardo Ortiz,Adjunct Professor,ortizg@indiana.edu,+1(812) 855-0367
Charles Pope,"Assistant Chair, Computer Science;Senior Lecturer",cepope@indiana.edu,+1(812) 855-4647
Christopher Raphael,Director of Intelligent Interactive Systems Ph.D. track;Professor of Music Informatics,craphael@indiana.edu,+1(812) 856-1849
Gregory Rawlins,Associate Professor of Computer Science,rawlins@indiana.edu,+1(812) 855-3952
Amr Sabry,Professor of Computer Science,sabry@indiana.edu,+1(812) 855-3668
Chung-chieh Shan,Associate Professor,ccshan@indiana.edu,+1(812) 856-4400
Jeremy Siek,Professor,jsiek@indiana.edu,+1(812) 855-7241
Haixu Tang,"Professor of Informatics and Computing;Director, Data Science Academic Programs",hatang@indiana.edu,+1(812) 856-1859
Wei Tang,Assistant Scientist,wt1@iu.edu,+1(812) 856-7446
Zoran Tiganj,Assistant Professor of Computer Science,ztiganj@iu.edu,
Sam Tobin-Hochstadt,Director of Undergraduate Studies for Computer Science;Associate Professor,samth@indiana.edu,
Dirk Van Gucht,Professor of Computer Science,vgucht@cs.indiana.edu,+1(812) 855-6429
XiaoFeng Wang,"Director of Secure Computing;James H. Rudy Professor of Computer Science, Engineering and Informatics",xw7@indiana.edu,+1(812) 856-1862
Yijie Wang,Assistant Professor,yijwang@iu.edu,
Erik Wennstrom,Lecturer,ewennstr@indiana.edu,
Jeff Whitmer,Senior Lecturer of Computer Science and Informatics,jwhitmer@cs.indiana.edu,+1(812) 855-3974
Donald Williamson,Assistant Professor,williads@indiana.edu,+1(812) 856-3716
Luyi Xing,Assistant Professor of Computer Science,luyixing@indiana.edu,
Yuzhen Ye,"Chair, Computer Science;Professor of Informatics and Computer Science",yye@indiana.edu,
Qin Zhang,Associate Professor,qzhangcs@indiana.edu,
Yuan Zhou,Adjunct Professor,yzhoucs@indiana.edu,
