name,designation,email,phone
Dana Angluin,Professor of Computer Science,dana.angluin@yale.edu,203-432-1273
James Aspnes,Professor of Computer Science; Director of Undergraduate Studies Computer Science (on leave Fall 2018),james.aspnes@yale.edu,203-533-9862
Abhishek Bhattacharjee,Associate Professor of Computer Science,abhishek@cs.yale.edu,
Yang Cai,Assistant Professor of Computer Science and Economics,yang.cai@yale.edu,203-432-1229
Julie Dorsey,Frederick W. Beinecke Professor of Computer Science,julie.dorsey@yale.edu,203-432-4249
Joan Feigenbaum,Grace Murray Hopper Professor of Computer Science and Economics; Professor (Adjunct) of Law,joan.feigenbaum@yale.edu,203-432-6432
Michael Fischer,Professor of Computer Science,michael.fischer@yale.edu,203-432-1270
David Gelernter,Professor of Computer Science,david.gelernter@yale.edu,203-432-1240
Anurag Khandelwal,Assistant Professor,anurag.khandelwal@yale.edu,
Theodore Kim,Associate Professor of Computer Science,theodore.kim@yale.edu,
Charalampos Papamanthou,Associate Professor,charalampos.papamanthou@yale.edu,
Ruzica Piskac,Dubinsky Associate Professor of Computer Science,ruzica.piskac@yale.edu,203-432-8001
Dragomir Radev,A. Bartlett Giamatti Professor of Computer Science,dragomir.radev@yale.edu,203.436.4759
Vladimir Rokhlin,Arthur K. Watson Professor Computer Science and Mathematics; Director of Graduate Studies in Computer Science. Joined Yale Faculty 1985.,vladimir.rokhlin@yale.edu,203-432-1278
Holly Rushmeier,John C. Malone Professor of Computer Science,holly.rushmeier@yale.edu,203-432-4091
Brian Scassellati,A. Bartlett Giamatti Professor of Computer Science and Professor of Mechanical Engineering and Materials Science,brian.scassellati@yale.edu,203-432-1219
Zhong Shao B.S.",Thomas L. Kempner Professor of Computer Science; Department Chair of Computer Science Department,zhong.shao@yale.edu,203-432-6828
Abraham Silberschatz,Sidney J. Weinberg Professor Computer Science,abraham.silberschatz@yale.edu,203-432-4713
Robert Soul�,Assistant Professor of Computer Science,robert.soule@yale.edu,203.432.1215
Daniel Spielman,Sterling Professor of Computer Science and Professor of Statistics and Data Science and of Mathematics,daniel.spielman@yale.edu,203-436-1264
Marynel V�zquez,Assistant Professor of Computer Science,marynel.vazquez@yale.edu,
Nisheeth Vishnoi,Professor of Computer Science,nisheeth.vishnoi@yale.edu,
Andre Wibisono,Assistant Professor,andre.wibisono@yale.edu,
Y.Richard Yang",Professor of Computer Science and Electrical Engineering,yang.r.yang@yale.edu,203-432-6400
Lin Zhong,Professor of Computer Science,lin.zhong@yale.edu,203.436.9450
Steven Zucker,David and Lucile Packard Professor of Computer Science and Biomedical Engineering,steven.zucker@yale.edu,203-432-6434

